{
  "schema": 2,
  "registry": "Future-Element/pinset",
  "generated-at": "2026-09-08T00:00:00Z",
  "providers": [
    {
      "id": "pinset/node",
      "tool": "node",
      "commands": ["node", "npm", "npx", "corepack"],
      "dependencies": [],
      "capabilities": {
        "command-layout": "node-native",
        "metadata": "node",
        "installer": "node",
        "environment": "none",
        "lock-audit": "artifact-receipt",
        "provenance": { "methods": ["open-pgp-signed-checksum"], "release-time": true }
      }
    },
    {
      "id": "pinset/pnpm",
      "tool": "pnpm",
      "commands": ["pnpm"],
      "dependencies": ["node"],
      "capabilities": {
        "command-layout": "root",
        "metadata": "npm",
        "installer": "npm",
        "environment": "none",
        "lock-audit": "artifact-receipt",
        "provenance": { "methods": ["npm-registry-signature"], "release-time": true }
      }
    },
    {
      "id": "pinset/bun",
      "tool": "bun",
      "commands": ["bun", "bunx"],
      "dependencies": [],
      "capabilities": {
        "command-layout": "bin",
        "metadata": "npm",
        "installer": "npm",
        "environment": "none",
        "lock-audit": "artifact-receipt",
        "provenance": { "methods": ["npm-registry-signature"], "release-time": true }
      }
    },
    {
      "id": "pinset/go",
      "tool": "go",
      "commands": ["go", "gofmt"],
      "dependencies": [],
      "capabilities": {
        "command-layout": "bin",
        "metadata": "go",
        "installer": "go",
        "environment": "go",
        "lock-audit": "artifact-receipt",
        "provenance": { "methods": ["https-checksum"], "release-time": false }
      }
    },
    {
      "id": "pinset/flutter",
      "tool": "flutter",
      "commands": ["flutter", "dart"],
      "dependencies": [],
      "capabilities": {
        "command-layout": "bin",
        "metadata": "flutter",
        "installer": "flutter",
        "environment": "flutter",
        "lock-audit": "artifact-receipt",
        "provenance": { "methods": ["https-checksum"], "release-time": true }
      }
    },
    {
      "id": "pinset/python",
      "tool": "python",
      "commands": ["python", "python3", "pip", "pip3"],
      "dependencies": [],
      "capabilities": {
        "command-layout": "python",
        "metadata": "python",
        "installer": "python",
        "environment": "python",
        "lock-audit": "artifact-receipt",
        "provenance": { "methods": ["https-checksum"], "release-time": true }
      }
    },
    {
      "id": "pinset/java",
      "tool": "java",
      "commands": ["java", "javac", "jar", "javadoc", "javap", "keytool", "jshell"],
      "dependencies": [],
      "capabilities": {
        "command-layout": "java",
        "metadata": "java",
        "installer": "java",
        "environment": "java",
        "lock-audit": "artifact-receipt",
        "provenance": { "methods": ["https-checksum"], "release-time": true }
      }
    },
    {
      "id": "pinset/rust",
      "tool": "rust",
      "commands": ["rustc", "cargo", "rustdoc", "rustfmt", "cargo-fmt", "clippy-driver", "cargo-clippy"],
      "dependencies": [],
      "capabilities": {
        "command-layout": "bin",
        "metadata": "rust",
        "installer": "rust",
        "environment": "none",
        "lock-audit": "artifact-receipt",
        "provenance": { "methods": ["https-checksum"], "release-time": true }
      }
    },
    {
      "id": "pinset/dotnet",
      "tool": "dotnet",
      "commands": ["dotnet"],
      "dependencies": [],
      "capabilities": {
        "command-layout": "root",
        "metadata": "dotnet",
        "installer": "dotnet",
        "environment": "dotnet",
        "lock-audit": "artifact-receipt",
        "provenance": { "methods": ["https-checksum"], "release-time": true }
      }
    },
    {
      "id": "pinset/jq",
      "tool": "jq",
      "commands": ["jq"],
      "dependencies": [],
      "revision": 1,
      "disabled": false,
      "capabilities": {
        "command-layout": "root",
        "metadata": "github-release-binary",
        "installer": "github-release-binary",
        "environment": "none",
        "lock-audit": "artifact-receipt",
        "provenance": { "methods": ["https-checksum"], "release-time": true }
      },
      "backend": {
        "kind": "github-release-binary",
        "repository": "jqlang/jq",
        "tag-prefix": "jq-",
        "checksum-asset": "sha256sum.txt",
        "assets": {
          "windows-x86_64": "jq-windows-amd64.exe",
          "macos-aarch64": "jq-macos-arm64",
          "macos-x86_64": "jq-macos-amd64",
          "linux-x86_64": "jq-linux-amd64",
          "linux-aarch64": "jq-linux-arm64"
        }
      }
    }
  ]
}
